{
  "kind": "profile",
  "schema_version": "1.0.0",
  "id": "full-discovery",
  "status": "PROPOSED_SELECTION_AID",
  "candidate_domains": [
    "D01",
    "D02",
    "D03",
    "D04",
    "D05",
    "D06",
    "D07",
    "D08",
    "D09",
    "D10",
    "D11",
    "D12",
    "D13",
    "D14",
    "D15",
    "D16",
    "D17",
    "D18"
  ],
  "default_applicability": "UNRESOLVED",
  "note": "Survey the full candidate bank, retaining unresolved applicability and unvisited frontier; do not require all entries for every release.",
  "automatic_exclusions": [],
  "mandatory_gates": []
}
