{
  "kind": "profile",
  "schema_version": "1.0.0",
  "id": "service",
  "status": "PROPOSED_SELECTION_AID",
  "candidate_domains": [
    "D01",
    "D03",
    "D04",
    "D05",
    "D06",
    "D07",
    "D08",
    "D12",
    "D13",
    "D14",
    "D15",
    "D16",
    "D17",
    "D18"
  ],
  "default_applicability": "UNRESOLVED",
  "note": "Real protocols, authorization, persistence, rollout and operating outcomes.",
  "automatic_exclusions": [],
  "mandatory_gates": []
}
