{
  "kind": "profile",
  "schema_version": "1.0.0",
  "id": "web",
  "status": "PROPOSED_SELECTION_AID",
  "candidate_domains": [
    "D01",
    "D03",
    "D04",
    "D05",
    "D06",
    "D09",
    "D10",
    "D11",
    "D12",
    "D13",
    "D14",
    "D15",
    "D16",
    "D17",
    "D18"
  ],
  "default_applicability": "UNRESOLVED",
  "note": "Rendered journeys plus actual backend effects; browser scans alone do not establish accessibility conformance.",
  "automatic_exclusions": [],
  "mandatory_gates": []
}
